Position	Start date	End date	Max. Hourly rate	Hours/week	Location	Deadline	Company	Submitter	Status	Candidate	URL	Description
Software Engineer		30/12/2024		36 uren per week	Den Haag	25/04/2024	Ministry of Justice and Security (JenV)		Open	[]	https://striive.com/nl/opdrachten/ministerie-van-justitie-veiligheid-jenv/software-engineer/73d85ece-68cc-42d3-bb58-924354fd9d5e	"Assignment Details
                -------------------
                Requirements: Minimaal een afgeronde bachelor opleiding in Technische Informatica en/of Software Engineering, Minimaal een certificaat in Scrum Foundations en/of Scrum Master, Minimaal zeven (7) jaar werkervaring met diverse programmeertalen waaronder in ieder geval Java en/of Python, Minimaal vijf (5) jaar werkervaring met Postgres en/of Elasticsearch en/of Bamboo en/of Javascript, Minimaal vijf (5) jaar werkervaring met het werken in het forensisch domein, Minimaal drie (3) jaar werkervaring met Kubernetes en/of docker en/of Istio, Aantoonbare ervaring met het schrijven van automatische testen, Aantoonbare ervaring in het vertalen van requirements naar technische en/of functionele analyses

                Preferences: Een creatieve puzzelaar die zich graag vastbijt in complexe uitdagingen en doorgraaft tot de oplossing gevonden is, Een teamspeler die energie krijgt van samenwerken en graag het initiatief neemt, Kritisch en werkt op een nauwkeurige en systematische manier en toetst resultaten bij collega's, Een pragmatische aanpak vanuit een oplossingsgerichte instelling, Graag kennis en ervaringen deelt en nieuwsgierig is naar de ideeën van anderen

                Skills: Klantgerichtheid, Omgevingsbewustzijn, Plannen en organiseren, Voorgangscontrole, Probleemanalyse, Mondelinge en schriftelijke uitdrukkingsvaardigheid, Resultaatgerichtheid, Samenwerken, Betrokkenheid, '
        "
